,count(577)
医者談義　五冊 　　　　　　富士川本,1
者談義　五冊 　　　　　　富士川本　,1
談義　五冊 　　　　　　富士川本　イ,1
義　五冊 　　　　　　富士川本　イ　,1
　五冊 　　　　　　富士川本　イ　3,1
五冊 　　　　　　富士川本　イ　39,1
冊 　　　　　　富士川本　イ　395,1
【整理ラベル・富士川本／イ／395】,8
【黒印・705823　昭和15.9.,4
黒印・705823　昭和15.9.5,4
印・705823　昭和15.9.5】,4
【「わろ」＝人をののしっていう時に使,1
「わろ」＝人をののしっていう時に使う,1
わろ」＝人をののしっていう時に使う】,1
【赤線や黒丸の書き込みがあるが翻刻に,1
赤線や黒丸の書き込みがあるが翻刻には,1
線や黒丸の書き込みがあるが翻刻には書,1
や黒丸の書き込みがあるが翻刻には書か,1
黒丸の書き込みがあるが翻刻には書かず,1
丸の書き込みがあるが翻刻には書かず】,1
一里は日本の六町なり然れば唐の五里は,1
里は日本の六町なり然れば唐の五里は日,1
は日本の六町なり然れば唐の五里は日本,1
日本の六町なり然れば唐の五里は日本の,1
本の六町なり然れば唐の五里は日本の三,1
の六町なり然れば唐の五里は日本の三十,1
り唐の一両は十匁を以て一両とせりいか,1
唐の一両は十匁を以て一両とせりいかに,1
の一両は十匁を以て一両とせりいかにも,1
ことあるべし今見る所の独参湯は五分或,1
とあるべし今見る所の独参湯は五分或は,1
あるべし今見る所の独参湯は五分或は一,1
るべし今見る所の独参湯は五分或は一匁,1
なを取はやすよしなり近比時めく医者に,1
の朝鮮とうけがへり■■【去々ヵ】年の,1
朝鮮とうけがへり■■【去々ヵ】年の事,1
鮮とうけがへり■■【去々ヵ】年の事と,1
とうけがへり■■【去々ヵ】年の事とや,1
のまぎら人参を一両代金十両とかき付て,1
まぎら人参を一両代金十両とかき付てや,1
ぎら人参を一両代金十両とかき付てやる,1
ら人参を一両代金十両とかき付てやる手,1
人参を一両代金十両とかき付てやる手■,1
参を一両代金十両とかき付てやる手■【,1
を一両代金十両とかき付てやる手■【に,1
一両代金十両とかき付てやる手■【にヵ,1
両代金十両とかき付てやる手■【にヵ】,1
【牙人＝がじん、牙儈＝すあい、どちら,1
牙人＝がじん、牙儈＝すあい、どちらも,1
人＝がじん、牙儈＝すあい、どちらも売,1
＝がじん、牙儈＝すあい、どちらも売買,1
がじん、牙儈＝すあい、どちらも売買の,1
じん、牙儈＝すあい、どちらも売買の仲,1
ん、牙儈＝すあい、どちらも売買の仲買,1
、牙儈＝すあい、どちらも売買の仲買人,1
牙儈＝すあい、どちらも売買の仲買人の,1
儈＝すあい、どちらも売買の仲買人のこ,1
＝すあい、どちらも売買の仲買人のこと,1
すあい、どちらも売買の仲買人のこと】,1
【耆婆＝古代インドの名医、扁鵲＝古代,1
耆婆＝古代インドの名医、扁鵲＝古代中,1
婆＝古代インドの名医、扁鵲＝古代中国,1
＝古代インドの名医、扁鵲＝古代中国の,1
古代インドの名医、扁鵲＝古代中国の名,1
代インドの名医、扁鵲＝古代中国の名医,1
インドの名医、扁鵲＝古代中国の名医】,1
り子ひとり四十におよんで妻もたず至て,1
の百までもあるものとおもつてしがみつ,1
百までもあるものとおもつてしがみつゐ,1
にまかせて三十日ばかりにやくわん屋の,1
まかせて三十日ばかりにやくわん屋の身,1
かせて三十日ばかりにやくわん屋の身代,1
せて三十日ばかりにやくわん屋の身代た,1
て三十日ばかりにやくわん屋の身代たゝ,1
六十六部は世間になふても事かけず医者,1
十六部は世間になふても事かけず医者と,1
六部は世間になふても事かけず医者と金,1
部は世間になふても事かけず医者と金銀,1
家の用心あるべきことなりと声はりあげ,1
出ていひひろめらるゝなあれにては医者,1
ていひひろめらるゝなあれにては医者は,1
いひひろめらるゝなあれにては医者はは,1
ひひろめらるゝなあれにては医者ははや,1
ひろめらるゝなあれにては医者ははやら,1
元禄年中の人参が今あればとて五十年以,1
禄年中の人参が今あればとて五十年以前,1
【阿毘羅吽欠・あびらうんけん＝大日如,1
阿毘羅吽欠・あびらうんけん＝大日如来,1
毘羅吽欠・あびらうんけん＝大日如来の,1
羅吽欠・あびらうんけん＝大日如来の真,1
吽欠・あびらうんけん＝大日如来の真言,1
欠・あびらうんけん＝大日如来の真言】,1
のくすりは一ふくわづか一匁より一匁四,1
くすりは一ふくわづか一匁より一匁四五,1
すりは一ふくわづか一匁より一匁四五分,1
のきびしさいらひどさもはやこらへがた,1
きびしさいらひどさもはやこらへがたく,1
びしさいらひどさもはやこらへがたく候,1
しさいらひどさもはやこらへがたく候こ,1
さいらひどさもはやこらへがたく候これ,1
いらひどさもはやこらへがたく候これ見,1
らひどさもはやこらへがたく候これ見さ,1
何をするやらと始のほとはおもひました,1
をするやらと始のほとはおもひましたが,1
で■【たヵ】つさせます頭をそれといへ,1
■【たヵ】つさせます頭をそれといへば,1
ござれども何ともならぬあん■■【ばく,1
ざれども何ともならぬあん■■【ばくヵ,1
れども何ともならぬあん■■【ばくヵ】,1
ども何ともならぬあん■■【ばくヵ】者,1
も何ともならぬあん■■【ばくヵ】者け,1
何ともならぬあん■■【ばくヵ】者けれ,1
ともならぬあん■■【ばくヵ】者けれと,1
もならぬあん■■【ばくヵ】者けれとも,1
ぜしときいへることあり不足虚分の症を,1
するに十日ばかりにして何のしるしも見,1
るに十日ばかりにして何のしるしも見へ,1
に十日ばかりにして何のしるしも見へざ,1
十日ばかりにして何のしるしも見へざれ,1
しとなげく文伯のいはく病を愈すことは,1
となげく文伯のいはく病を愈すことはい,1
なげく文伯のいはく病を愈すことはいと,1
げく文伯のいはく病を愈すことはいとや,1
く文伯のいはく病を愈すことはいとやす,1
文伯のいはく病を愈すことはいとやすし,1
なりましてや二年をやはやく治したきと,1
りましてや二年をやはやく治したきとい,1
ましてや二年をやはやく治したきといへ,1
してや二年をやはやく治したきといへり,1
当世は医者も病家も只補ふとさへいへば,1
の補たるを知らずとむべなるかな補中に,1
補たるを知らずとむべなるかな補中に瀉,1
たるを知らずとむべなるかな補中に瀉あ,1
るを知らずとむべなるかな補中に瀉あり,1
を知らずとむべなるかな補中に瀉あり瀉,1
知らずとむべなるかな補中に瀉あり瀉中,1
に明らかならずとは此こと也殊に頃年の,1
明らかならずとは此こと也殊に頃年の医,1
らかならずとは此こと也殊に頃年の医者,1
かならずとは此こと也殊に頃年の医者は,1
【挿絵のみ・地黄丸を売っている店先の,1
挿絵のみ・地黄丸を売っている店先の様,1
絵のみ・地黄丸を売っている店先の様子,1
のみ・地黄丸を売っている店先の様子】,1
道の道の字三喜の三の字を取てみつから,1
の道の字三喜の三の字を取てみつから道,1
道の字三喜の三の字を取てみつから道三,1
の字三喜の三の字を取てみつから道三と,1
字三喜の三の字を取てみつから道三と名,1
に於て其名天下に聞へたり今世上に用ゆ,1
於て其名天下に聞へたり今世上に用ゆる,1
て其名天下に聞へたり今世上に用ゆる所,1
其名天下に聞へたり今世上に用ゆる所の,1
法貴【常ヵ】のごとしといふ法は此道三,1
貴【常ヵ】のごとしといふ法は此道三よ,1
【常ヵ】のごとしといふ法は此道三より,1
れりかるがゆへに新流を当流といひ古流,1
りかるがゆへに新流を当流といひ古流を,1
かるがゆへに新流を当流といひ古流を他,1
るがゆへに新流を当流といひ古流を他流,1
がゆへに新流を当流といひ古流を他流と,1
ゆへに新流を当流といひ古流を他流と云,1
へに新流を当流といひ古流を他流と云ふ,1
も当流他流ともに昔は皆小包は香包にせ,1
当流他流ともに昔は皆小包は香包にせし,1
流他流ともに昔は皆小包は香包にせしを,1
【左ルビ・らけん】ならしめんがためな,1
左ルビ・らけん】ならしめんがためなり,1
【左ルビ・さいまつ】を用ゆるなり然る,1
左ルビ・さいまつ】を用ゆるなり然るに,1
ルビ・さいまつ】を用ゆるなり然るに此,1
合に水清上なるもの四十目入る然れば天,1
に水清上なるもの四十目入る然れば天目,1
水清上なるもの四十目入る然れば天目に,1
清上なるもの四十目入る然れば天目に一,1
水目百二十目京升に三合入なり天目とい,1
目百二十目京升に三合入なり天目といふ,1
百二十目京升に三合入なり天目といふは,1
二十目京升に三合入なり天目といふは茶,1
十目京升に三合入なり天目といふは茶わ,1
目京升に三合入なり天目といふは茶わん,1
京升に三合入なり天目といふは茶わんの,1
薬は服がさ小なり然れども煎じてあちは,1
は服がさ小なり然れども煎じてあちはひ,1
【貼紙に　イ二ウラ　の書き込みあり】,1
諸生の内に一人すゝみ出ていふやう只今,1
ばかりに候ひけり何と血狂の病人を物の,1
陰陽二儀の妙用なり夫陰陽の気を霊と云,1
陽二儀の妙用なり夫陰陽の気を霊と云ふ,1
医者のくすりなり諸生のいはく加持祈禱,1
者のくすりなり諸生のいはく加持祈禱は,1
■てなし元来女のはかなき手わざに神木,1
てなし元来女のはかなき手わざに神木に,1
くさしうつむき何ごとやらん工夫してや,1
さしうつむき何ごとやらん工夫してやす,1
しうつむき何ごとやらん工夫してやす〳,1
うつむき何ごとやらん工夫してやす〳〵,1
とばらしてのけん金子二十両出せといふ,1
ばらしてのけん金子二十両出せといふい,1
らしてのけん金子二十両出せといふいと,1
してのけん金子二十両出せといふいとや,1
すしと金子を渡しければ医者彼薬種屋の,1
に行てべいさらばさらを買わんといふ薬,1
行てべいさらばさらを買わんといふ薬種,1
てべいさらばさらを買わんといふ薬種屋,1
べいさらばさらを買わんといふ薬種屋の,1
手代共候とて出しければひたもの【注】,1
代共候とて出しければひたもの【注】ひ,1
共候とて出しければひたもの【注】ひね,1
候とて出しければひたもの【注】ひねく,1
とて出しければひたもの【注】ひねくり,1
て出しければひたもの【注】ひねくり廻,1
出しければひたもの【注】ひねくり廻し,1
て見居たりければ手代どもいひけるはそ,1
見居たりければ手代どもいひけるはそも,1
居たりければ手代どもいひけるはそも此,1
たりければ手代どもいひけるはそも此べ,1
りければ手代どもいひけるはそも此べい,1
さらばさらと申物いかなる病を治する薬,1
らばさらと申物いかなる病を治する薬に,1
ばさらと申物いかなる病を治する薬にて,1
さらと申物いかなる病を治する薬にて候,1
【虫損部は山口大学図書館所蔵本を参照,1
虫損部は山口大学図書館所蔵本を参照　,1
損部は山口大学図書館所蔵本を参照　h,1
部は山口大学図書館所蔵本を参照　ht,1
は山口大学図書館所蔵本を参照　htt,1
山口大学図書館所蔵本を参照　http,1
口大学図書館所蔵本を参照　https,1
大学図書館所蔵本を参照　https:,1
学図書館所蔵本を参照　https:/,1
図書館所蔵本を参照　https://,1
書館所蔵本を参照　https://k,1
館所蔵本を参照　https://ko,1
所蔵本を参照　https://kot,1
蔵本を参照　https://kote,1
本を参照　https://koten,1
を参照　https://kotens,1
参照　https://kotense,1
照　https://kotensek,1
　https://kotenseki,1
https://kotenseki.,1
ttps://kotenseki.n,1
tps://kotenseki.ni,1
ps://kotenseki.nij,1
s://kotenseki.nijl,1
://kotenseki.nijl.,1
//kotenseki.nijl.a,1
/kotenseki.nijl.ac,1
kotenseki.nijl.ac.,1
otenseki.nijl.ac.j,1
tenseki.nijl.ac.jp,1
enseki.nijl.ac.jp/,1
nseki.nijl.ac.jp/b,1
seki.nijl.ac.jp/bi,1
eki.nijl.ac.jp/bib,1
ki.nijl.ac.jp/bibl,1
i.nijl.ac.jp/bibli,1
.nijl.ac.jp/biblio,1
nijl.ac.jp/biblio/,1
ijl.ac.jp/biblio/1,1
jl.ac.jp/biblio/10,1
l.ac.jp/biblio/100,1
.ac.jp/biblio/1002,1
ac.jp/biblio/10026,1
c.jp/biblio/100269,1
.jp/biblio/1002698,1
jp/biblio/10026985,1
p/biblio/100269851,1
/biblio/100269851/,1
biblio/100269851/v,1
iblio/100269851/vi,1
blio/100269851/vie,1
lio/100269851/view,1
io/100269851/viewe,1
o/100269851/viewer,1
/100269851/viewer/,1
100269851/viewer/4,1
00269851/viewer/46,1
0269851/viewer/46】,1
ことはあるべけれども近く見聞したまふ,1
とはあるべけれども近く見聞したまふこ,1
はあるべけれども近く見聞したまふこと,1
あるべけれども近く見聞したまふことは,1
るべけれども近く見聞したまふことは有,1
たまはり候へども日本にはなきものゝや,1
まはり候へども日本にはなきものゝやう,1
はり候へども日本にはなきものゝやうに,1
り候へども日本にはなきものゝやうに存,1
候へども日本にはなきものゝやうに存候,1
付て何とぞ此病を治する医者やあるとた,1
て何とぞ此病を治する医者やあるとたづ,1
何とぞ此病を治する医者やあるとたづね,1
せるを聞出して頃日しきりにたのむゆへ,1
ことの外いぶかしくおもひてなを〳〵其,1
との外いぶかしくおもひてなを〳〵其病,1
の外いぶかしくおもひてなを〳〵其病人,1
外いぶかしくおもひてなを〳〵其病人の,1
くるしからずはちらとおしらせくだされ,1
るしからずはちらとおしらせくだされか,1
しからずはちらとおしらせくだされかし,1
からずはちらとおしらせくだされかしと,1
いへば医者心中にしてくれたりとおもひ,1
へば医者心中にしてくれたりとおもひか,1
ば医者心中にしてくれたりとおもひかな,1
医者心中にしてくれたりとおもひかなら,1
にまみゆる所存なきものに候へば様子の,1
してしか〳〵の事ありしとべいさらばさ,1
てしか〳〵の事ありしとべいさらばさら,1
しか〳〵の事ありしとべいさらばさらの,1
けるやといへば媒其義はうけたまはらず,1
るやといへば媒其義はうけたまはらずと,1
やといへば媒其義はうけたまはらずとい,1
といへば媒其義はうけたまはらずといふ,1
いへば媒其義はうけたまはらずといふに,1
へば媒其義はうけたまはらずといふに付,1
尤とまた薬種やへ走り行て尋れば手代共,1
されば其ときにたれも気が付ずして医者,1
の名を尋ざりしと是よりむつかしく成て,1
て居ける所を尋付て何ごとなきていてに,1
居ける所を尋付て何ごとなきていてにて,1
ける所を尋付て何ごとなきていてにて先,1
る所を尋付て何ごとなきていてにて先日,1
は始て心意を得候御宿は是にて候哉と名,1
始て心意を得候御宿は是にて候哉と名札,1
て心意を得候御宿は是にて候哉と名札し,1
宿もいひつかはしければ牢人けでんして,1
もいひつかはしければ牢人けでんしてそ,1
いひつかはしければ牢人けでんしてそれ,1
ひつかはしければ牢人けでんしてそれは,1
ければこと〴〵く御吟味ありしに屋主と,1
にて江戸追ひはらはれ家財を牢人に下さ,1
て江戸追ひはらはれ家財を牢人に下され,1
とて町中にもばつと沙汰有程になりける,1
て町中にもばつと沙汰有程になりけると,1
町中にもばつと沙汰有程になりけるとな,1
中にもばつと沙汰有程になりけるとなり,1
是等は此類なき悪事なり又あるべきこと,1
等は此類なき悪事なり又あるべきことな,1
は此類なき悪事なり又あるべきことなら,1
此類なき悪事なり又あるべきことならず,1
して大の虫を助くるとの利口をいふとい,1
て大の虫を助くるとの利口をいふといへ,1
大の虫を助くるとの利口をいふといへど,1
の虫を助くるとの利口をいふといへども,1
するなり或は夫婦の中にも子共大勢に成,1
るなり或は夫婦の中にも子共大勢に成て,1
なり大名高家には一向なきことにして正,1
り大名高家には一向なきことにして正月,1
第につよく打くだくごとくに成て日数つ,1
につよく打くだくごとくに成て日数つも,1
つよく打くだくごとくに成て日数つもり,1
よく打くだくごとくに成て日数つもりて,1
かならず此薬を伝ふべからすといふ子共,1
ならず此薬を伝ふべからすといふ子共の,1
らず此薬を伝ふべからすといふ子共のい,1
ず此薬を伝ふべからすといふ子共のいは,1
此薬を伝ふべからすといふ子共のいはく,1
せる所いかなる子細ぞといへば其母のい,1
る所いかなる子細ぞといへば其母のいは,1
所いかなる子細ぞといへば其母のいはく,1
いかなる子細ぞといへば其母のいはく我,1
言すべし医はかねておもふべしかゝはれ,1
すべし医はかねておもふべしかゝはれな,1
べし医はかねておもふべしかゝはれなる,1
今三日のうちに治せずんばまさに誅すべ,1
三日のうちに治せずんばまさに誅すべし,1
一瓜にあせをながすこと玉のごとし家に,1
瓜にあせをながすこと玉のごとし家にか,1
にあせをながすこと玉のごとし家にかへ,1
くすりくをかふて上さまへとすゝめめれ,1
すりくをかふて上さまへとすゝめめれば,1
あらんときいかゞせん無用〳〵といかれ,1
らんときいかゞせん無用〳〵といかれて,1
ねば同薬を以て治しがたし然るにあるい,1
ば同薬を以て治しがたし然るにあるいは,1
を用ひて諸病を治せしたぐひなりしかし,1
用ひて諸病を治せしたぐひなりしかし藤,1
或は学文ありといへども心ざなあしき医,1
は学文ありといへども心ざなあしき医は,1
学文ありといへども心ざなあしき医は人,1
文ありといへども心ざなあしき医は人前,1
ありといへども心ざなあしき医は人前に,1
りといへども心ざなあしき医は人前にて,1
といへども心ざなあしき医は人前にては,1
として病用あるときはあのゝものゝとい,1
して病用あるときはあのゝものゝといひ,1
て病用あるときはあのゝものゝといひは,1
病用あるときはあのゝものゝといひはづ,1
用あるときはあのゝものゝといひはづし,1
医者談義巻五　【富士川游寄贈】【角印,1
者談義巻五　【富士川游寄贈】【角印】,1
たり家の子其日より疱瘡にかゝれりとな,1
り家の子其日より疱瘡にかゝれりとなり,1
家の子其日より疱瘡にかゝれりとなり然,1
の子其日より疱瘡にかゝれりとなり然れ,1
子其日より疱瘡にかゝれりとなり然れば,1
りならず疱瘡するといへりこゝにおいて,1
ならず疱瘡するといへりこゝにおいてか,1
らず疱瘡するといへりこゝにおいてかん,1
ず疱瘡するといへりこゝにおいてかんが,1
疱瘡するといへりこゝにおいてかんがふ,1
瘡するといへりこゝにおいてかんがふる,1
するといへりこゝにおいてかんがふるに,1
をうれふ人一生に一たびうれひてふたゝ,1
うれふ人一生に一たびうれひてふたゝび,1
れふ人一生に一たびうれひてふたゝびう,1
ふ人一生に一たびうれひてふたゝびうれ,1
人一生に一たびうれひてふたゝびうれひ,1
きたりて中華日本ともにさかんになりし,1
たりて中華日本ともにさかんになりしな,1
りて中華日本ともにさかんになりしなり,1
見くだして他家の人の目に見へしといふ,1
の水なき所に水を生じ火なきところに火,1
水なき所に水を生じ火なきところに火を,1
いだせといふ船賃なしといへばわたされ,1
だせといふ船賃なしといへばわたされず,1
せといふ船賃なしといへばわたされずと,1
といふ船賃なしといへばわたされずと伝,1
しとてづぶ〳〵と水に入てかち渡りせし,1
とてづぶ〳〵と水に入てかち渡りせしな,1
てづぶ〳〵と水に入てかち渡りせしなり,1
たり物の人をたぶらかす皆此類なり近き,1
ありて厥界の外気のおよばざる所にいた,1
りて厥界の外気のおよばざる所にいたり,1
いへども更に狐狸はこんともすんともい,1
へども更に狐狸はこんともすんともいか,1
ども更に狐狸はこんともすんともいかね,1
も更に狐狸はこんともすんともいかねど,1
更に狐狸はこんともすんともいかねども,1
に狐狸はこんともすんともいかねどもま,1
狐狸はこんともすんともいかねどもまど,1
のうたがひあるとき其うたがひを決する,1
うたがひあるとき其うたがひを決する【,1
たがひあるとき其うたがひを決する【左,1
がひあるとき其うたがひを決する【左追,1
ひあるとき其うたがひを決する【左追記,1
あるとき其うたがひを決する【左追記?,1
るとき其うたがひを決する【左追記?】,1
とき其うたがひを決する【左追記?】・,1
き其うたがひを決する【左追記?】・は,1
其うたがひを決する【左追記?】・は易,1
うたがひを決する【左追記?】・は易の,1
たがひを決する【左追記?】・は易の【,1
がひを決する【左追記?】・は易の【戻,1
ひを決する【左追記?】・は易の【戻る,1
を決する【左追記?】・は易の【戻る】,1
を治す標本ともに急なれば標本兼治す右,1
は知らざるなり今の医は標本を編ずるは,1
に論ぜり 丹水子のいへるは不学の医は,1
論ぜり 丹水子のいへるは不学の医は常,1
ぜり 丹水子のいへるは不学の医は常に,1
の名あるひとを一人治すれば それより,1
名あるひとを一人治すれば それよりし,1
あるひとを一人治すれば それよりして,1
からげして走りまはれどもおもふやうに,1
らげして走りまはれどもおもふやうには,1
げして走りまはれどもおもふやうにはや,1
して走りまはれどもおもふやうにはやら,1
水なりに三十四五年以前一とせ城南寺の,1
なりに三十四五年以前一とせ城南寺の水,1
りに三十四五年以前一とせ城南寺の水も,1
に三十四五年以前一とせ城南寺の水もら,1
三十四五年以前一とせ城南寺の水もらい,1
むかし寛永年中のなりし北国何村とかや,1
かし寛永年中のなりし北国何村とかやい,1
し寛永年中のなりし北国何村とかやいふ,1
寛永年中のなりし北国何村とかやいふと,1
永年中のなりし北国何村とかやいふとこ,1
年中のなりし北国何村とかやいふところ,1
にもりて出しければ取てさりぬ翌日其あ,1
もりて出しければ取てさりぬ翌日其あた,1
りて出しければ取てさりぬ翌日其あたり,1
て出しければ取てさりぬ翌日其あたりの,1
山姥の御利生にて安産したりとふいちや,1
姥の御利生にて安産したりとふいちやう,1
の御利生にて安産したりとふいちやうし,1
御利生にて安産したりとふいちやうして,1
をたづねさせられければ彼山姥といひし,1
たづねさせられければ彼山姥といひしは,1
づねさせられければ彼山姥といひしは其,1
ねさせられければ彼山姥といひしは其所,1
させられければ彼山姥といひしは其所の,1
ければ女のしるべのもの越路にありけり,1
れば女のしるべのもの越路にありけりそ,1
ば女のしるべのもの越路にありけりそれ,1
女のしるべのもの越路にありけりそれを,1
のしるべのもの越路にありけりそれをた,1
