けるをたにおみにおもふて行けるに女の,1
るをたにおみにおもふて行けるに女のは,1
をたにおみにおもふて行けるに女のはか,1
たにおみにおもふて行けるに女のはかな,1
におみにおもふて行けるに女のはかなき,1
おみにおもふて行けるに女のはかなきは,1
みにおもふて行けるに女のはかなきは其,1
におもふて行けるに女のはかなきは其村,1
うとみにくみて越路にもたらずみがたく,1
此沙汰ひろごりてひそ〳〵と人こぞりも,1
沙汰ひろごりてひそ〳〵と人こぞりもや,1
汰ひろごりてひそ〳〵と人こぞりもやみ,1
ひろごりてひそ〳〵と人こぞりもやみ山,1
姥堂もこぼち捨けるとかや物のはやるは,1
堂もこぼち捨けるとかや物のはやるは皆,1
もこぼち捨けるとかや物のはやるは皆か,1
こぼち捨けるとかや物のはやるは皆かく,1
ぼち捨けるとかや物のはやるは皆かくの,1
ごとしあとかたもなきことがいひふれて,1
としあとかたもなきことがいひふれてく,1
しあとかたもなきことがいひふれてくこ,1
あとかたもなきことがいひふれてくこゝ,1
とかたもなきことがいひふれてくこゝの,1
かたもなきことがいひふれてくこゝの山,1
たもなきことがいひふれてくこゝの山の,1
を入てせんずべしといふものおほかりけ,1
入てせんずべしといふものおほかりけれ,1
てせんずべしといふものおほかりければ,1
おぼへしこそつたなけれ然れども大はや,1
ぼへしこそつたなけれ然れども大はやり,1
へしこそつたなけれ然れども大はやりし,1
しこそつたなけれ然れども大はやりして,1
もかゝる不学の医者をはやるは天とはい,1
かゝる不学の医者をはやるは天とはいひ,1
月にあらずんば治療しがたしとて十一月,1
此米屋をちらと見てつれなる人にいふや,1
米屋をちらと見てつれなる人にいふやう,1
入つどいなげくのみにて諸医手をつかね,1
つどいなげくのみにて諸医手をつかねて,1
してとらんとて彼男とともなひ来て形状,1
てとらんとて彼男とともなひ来て形状を,1
とらんとて彼男とともなひ来て形状を見,1
らへといふ何れも心得ずおもひながらふ,1
へといふ何れも心得ずおもひながらふろ,1
といふ何れも心得ずおもひながらふろし,1
いふ何れも心得ずおもひながらふろしき,1
ふ何れも心得ずおもひながらふろしきや,1
何れも心得ずおもひながらふろしきやう,1
を付て夜にいたらば又かゆかるべしかな,1
付て夜にいたらば又かゆかるべしかなら,1
て夜にいたらば又かゆかるべしかならず,1
夜にいたらば又かゆかるべしかならずか,1
にいたらば又かゆかるべしかならずかゝ,1
いたらば又かゆかるべしかならずかゝし,1
たらば又かゆかるべしかならずかゝしむ,1
る朝とく来りて膿を取事前日の三の一に,1
朝とく来りて膿を取事前日の三の一にし,1
とく来りて膿を取事前日の三の一にして,1
く来りて膿を取事前日の三の一にしても,1
来りて膿を取事前日の三の一にしてもは,1
一方の人をうらなひしにもおとるべから,1
方の人をうらなひしにもおとるべからず,1
の人をうらなひしにもおとるべからず今,1
人をうらなひしにもおとるべからず今と,1
をうらなひしにもおとるべからず今とて,1
うらなひしにもおとるべからず今とても,1
【「ねこのつらはなかけざり」左ルビ】,1
「ねこのつらはなかけざり」左ルビ】の,1
にも先はやり医をかけねはならずたとへ,1
とても百人が百人いやす事はあるまじ其,1
ても百人が百人いやす事はあるまじ其米,1
も百人が百人いやす事はあるまじ其米屋,1
百人が百人いやす事はあるまじ其米屋が,1
